<?xml version="1.0" encoding="utf-8"?>
<tk:Toolkit version="5.0" xsi:schemaLocation="http://www.qdocuments.net ..\..\schema\v5\CodeData.xsd" xmlns:tk="http://www.qdocuments.net" xmlns:xsi="http://www.w3.org/2001/XMLSchema-instance">
  <tk:CodeData RegName="ApproveOperator" Author="YJC" CreateDate="2018-04-04" Description="审核操作代码表">
    <tk:Row>
      <tk:Value>1</tk:Value>
      <tk:Name>
        <tk:Content>同意</tk:Content>
      </tk:Name>
    </tk:Row>
    <tk:Row>
      <tk:Value>0</tk:Value>
      <tk:Name>
        <tk:Content>不同意</tk:Content>
      </tk:Name>
    </tk:Row>
  </tk:CodeData>
</tk:Toolkit>
